{
  "uri": "dsor://org_456/proposal/prop_123",
  "tenant": "org_456",
  "operation": "payment.execute@1",
  "mode": "execute",
  "state": "PENDING_APPROVAL",
  "payload": {
    "payment": "dsor://org_456/payment/PAY-901"
  },
  "payload_hash": "sha256:9f2c1e7ab4d0",
  "resources": [
    "dsor://org_456/payment/PAY-901",
    "dsor://org_456/invoice/INV-1008",
    "dsor://org_456/vendor/VENDOR-44"
  ],
  "requester": {
    "identity_mode": "unattended",
    "subject": "user_123",
    "subject_type": "human",
    "actor_chain": [
      "accounts-payable-fte"
    ],
    "active_tenant": "org_456",
    "delegation": "del_100",
    "token_scopes": [
      "invoice:read",
      "vendor:read",
      "payment:create",
      "payment:execute"
    ],
    "subject_authority": {
      "source": "role_source",
      "as_of": "2026-09-20T08:45:00Z"
    }
  },
  "idempotency_key": "idem_789",
  "requires": [
    {
      "control": "high-value-payment",
      "control_version": 8,
      "approval": {
        "role": "CFO",
        "quorum": 1
      }
    }
  ],
  "reservation": {
    "limit": "del_100/P1D",
    "amount": {
      "value": "31400.00",
      "currency": "USD"
    },
    "state": "held"
  },
  "created_at": "2026-09-19T22:00:00Z",
  "expires_at": "2026-09-22T22:00:00Z",
  "transitions": [
    {
      "to": "PROPOSED",
      "at": "2026-09-19T22:00:00Z",
      "actor": "accounts-payable-fte",
      "cause": "payment.execute invoked"
    },
    {
      "from": "PROPOSED",
      "to": "PENDING_APPROVAL",
      "at": "2026-09-19T22:00:00Z",
      "actor": "dsor",
      "cause": "high-value-payment@8 REQUIRE_APPROVAL"
    }
  ]
}